{"dataset":{"audit":{"duplicate_policy":"retained_because_public_source_has_no_booking_identifier","excluded_zero_night_rows":715,"maximum_arrival_date":"2017-08-31","maximum_booking_date":"2017-08-31","minimum_arrival_date":"2015-07-01","minimum_booking_date":"2014-03-18","positive_rate":0.372353,"positive_rows":44189,"raw_exact_duplicate_rows":40165,"retained_rows":118675,"source_rows":119390},"doi":"https://doi.org/10.1016/j.dib.2018.11.126","license":"CC BY 4.0","license_url":"https://creativecommons.org/licenses/by/4.0/","snapshot_sha256":"7c2ae42a7353905ea136e5c2287f17c92c5435826598bfbb8491c6f0c7b1fc06","snapshot_url":"https://raw.githubusercontent.com/rfordatascience/tidytuesday/1f5a20eae51d871ec4ac0f95d16e43b9ba3f1dec/data/2020/2020-02-11/hotels.csv","title":"Hotel Booking Demand"},"evidence":{"reliability_bins":8,"shap_rows":15},"gate":{"balanced_accuracy_minimum":0.8,"decision":"RESEARCH_GATE_NOT_PASSED_NO_SAAS_INTEGRATION","macro_f1_minimum":0.8,"passed":false},"mapping":{"feature_count":15,"features":["agency_proxy","vehicle_category_proxy","deposit_required","arrival_month","arrival_weekday","booking_month","booking_weekday","lead_time_days","weekend_nights","weekday_nights","rental_nights","returning_customer","prior_cancellations","prior_completed_bookings","has_options"],"forbidden_leakage_columns":["is_canceled","reservation_status","reservation_status_date","assigned_room_type","booking_changes","days_in_waiting_list"],"raw_personal_data_allowed":false,"scope":"public_hotel_proxy_to_rentfleet_reservation_features","tenant_and_agency_policy":"derive_server_side_and_hmac_pseudonymize"},"model":{"calibration":"isotonic on a disjoint chronological block","explanation":"CatBoost native exact Tree SHAP on raw model margin","framework":"catboost","framework_version":"1.2.10","imbalance_strategy":"CatBoost auto_class_weights=Balanced on training blocks only","name":"cancellation_risk_catboost","parameters":{"allow_writing_files":false,"auto_class_weights":"Balanced","bootstrap_type":"Bernoulli","depth":8,"eval_metric":"AUC","iterations":63,"l2_leaf_reg":8.0,"learning_rate":0.04,"loss_function":"Logloss","random_seed":20260814,"random_strength":0.5,"subsample":0.85,"thread_count":1,"verbose":false},"selected_iterations":63,"version":"research-1.0.0"},"protocol":{"compute":"cpu","distance_unit":"km","prediction_cutoff":"one_day_before_planned_arrival_public_proxy","preprocessing_version":"hotel-booking-to-rentfleet-v1.0.0","seed":20260814,"test_policy":"final_contiguous_block_evaluated_after_model_calibration_and_threshold_freeze","version":"cancellation-risk-qualification-v1.0.0"},"runtime":{"architecture":"x86_64","catboost":"1.2.10","joblib":"1.5.3","matplotlib":"3.10.8","numpy":"2.3.5","operating_system":"Linux","pandas":"2.2.3","python":"3.12.13","scikit_learn":"1.8.0"},"safety":{"automatic_action_allowed":false,"consultative_only":true,"human_validation_required":true,"local_rentfleet_status":"NOT_VALIDATED_NO_REAL_HISTORY","operational_business_write_allowed":false,"production_claim_allowed":false,"saas_integration_allowed":false,"validation_scope":"PUBLIC_BENCHMARK"},"schema_version":"1.0.0","splits":{"blocks":{"calibration":{"date_from":"2017-01-06","date_to":"2017-03-25","positive_rate":0.337028,"positive_rows":3770,"rows":11186},"test":{"date_from":"2017-06-13","date_to":"2017-08-31","positive_rate":0.385548,"positive_rows":5186,"rows":13451},"threshold":{"date_from":"2017-03-26","date_to":"2017-06-12","positive_rate":0.428768,"positive_rows":6555,"rows":15288},"train":{"date_from":"2015-07-01","date_to":"2016-09-08","positive_rate":0.359007,"positive_rows":21423,"rows":59673},"validation":{"date_from":"2016-09-09","date_to":"2017-01-05","positive_rate":0.380301,"positive_rows":7255,"rows":19077}},"boundaries_starting_new_block":["2016-09-09","2017-01-06","2017-03-26","2017-06-13"],"fractions":{"calibration":0.1,"test":0.1,"threshold":0.1,"train":0.55,"validation":0.15},"strategy":"five_contiguous_arrival_date_blocks"},"test_metrics":{"always_arrival_baseline":{"balanced_accuracy":0.5,"macro_f1":0.380595},"balanced_accuracy":0.610399,"brier_loss":0.207954,"calibration_brier_delta":-0.003374,"confusion_matrix":{"true_arrival_pred_arrival":6818,"true_arrival_pred_risk":1447,"true_risk_pred_arrival":3133,"true_risk_pred_risk":2053},"ece_10":0.056037,"log_loss":0.598784,"macro_f1":0.610644,"per_class":{"arrival":{"f1-score":0.748573,"precision":0.685157,"recall":0.824924,"support":8265},"cancellation_or_no_show":{"f1-score":0.472715,"precision":0.586571,"recall":0.395874,"support":5186}},"pr_auc":0.58514,"roc_auc":0.690498,"threshold":0.377,"uncalibrated_brier_loss":0.20458},"threshold_selection":{"balanced_accuracy":0.689794,"macro_f1":0.692116,"threshold":0.377}}
